{
  "api_version": "sourceos.fabric.mount/v0.1",
  "kind": "AdapterProfile",
  "adapter_kind": "topolvm",
  "default_roles": ["bulk_sync"],
  "allowed_authority_modes": ["local_first", "hybrid"],
  "default_authority_mode": "local_first",
  "authority_requires_quorum": false,
  "supported_capabilities": [
    "local_persistent_storage",
    "snapshot_locality",
    "index_colocation"
  ],
  "notes": "Primary authoritative local persistence plane."
}
